Ether / ARP who has 172.17.0.1 says 172.17.0.2 

Ether / ARP who has 172.17.0.4 says 172.17.0.3 

Ether / ARP is at 02:42:ac:11:00:04 says 172.17.0.4 

Ether / IP / TCP 192.111.111.101:ftp_data > 172.17.0.4:bbs S / Raw 

Ether / ARP who has 172.17.0.1 says 172.17.0.4 

Ether / ARP is at 02:42:e8:79:af:98 says 172.17.0.1 

Ether / IP / TCP 172.17.0.4:bbs > 192.111.111.101:ftp_data SA 

Ether / IP / TCP 192.111.111.101:ftp_data > 172.17.0.4:bbs S / Raw 

Ether / IP / TCP 172.17.0.4:bbs > 192.111.111.101:ftp_data SA 

Ether / IP / TCP 192.111.111.101:ftp_data > 172.17.0.4:bbs S / Raw 

Ether / IP / TCP 192.111.111.101:ftp_data > 172.17.0.4:bbs S / Raw 

Ether / IP / TCP 192.111.111.101:ftp_data > 172.17.0.4:bbs S / Raw 

Ether / IP / TCP 192.111.111.101:ftp_data > 172.17.0.4:bbs S / Raw 

Ether / IP / TCP 192.111.111.101:ftp_data > 172.17.0.4:bbs S / Raw 

Ether / IP / TCP 192.111.111.101:ftp_data > 172.17.0.4:bbs S / Raw 

Ether / IP / TCP 192.111.111.101:ftp_data > 172.17.0.4:bbs S / Raw 

Ether / IP / TCP 192.111.111.101:ftp_data > 172.17.0.4:bbs S / Raw 

Ether / IP / TCP 192.111.111.101:ftp_data > 172.17.0.4:bbs S / Raw 

Ether / IP / TCP 192.111.111.101:ftp_data > 172.17.0.4:bbs S / Raw 

Ether / IP / TCP 192.111.111.101:ftp_data > 172.17.0.4:bbs S / Raw 

Ether / IP / TCP 192.111.111.101:ftp_data > 172.17.0.4:bbs S / Raw 

Ether / IP / TCP 192.111.111.101:ftp_data > 172.17.0.4:bbs S / Raw 

Ether / IP / TCP 192.111.111.101:ftp_data > 172.17.0.4:bbs S / Raw 

Ether / IP / TCP 192.111.111.101:ftp_data > 172.17.0.4:bbs S / Raw 

Ether / IP / TCP 192.111.111.101:ftp_data > 172.17.0.4:bbs S / Raw 

Ether / IP / TCP 192.111.111.101:ftp_data > 172.17.0.4:bbs S / Raw 

Ether / IP / TCP 172.17.0.4:bbs > 192.111.111.101:ftp_data SA 

Ether / IP / TCP 192.111.111.101:ftp_data > 172.17.0.4:bbs S / Raw 

Ether / IP / TCP 192.111.111.101:ftp_data > 172.17.0.4:bbs S / Raw 

Ether / IP / TCP 192.111.111.101:ftp_data > 172.17.0.4:bbs S / Raw 

Ether / IP / TCP 192.111.111.101:ftp_data > 172.17.0.4:bbs S / Raw 

Ether / IP / TCP 192.111.111.101:ftp_data > 172.17.0.4:bbs S / Raw 

Ether / IP / TCP 192.111.111.101:ftp_data > 172.17.0.4:bbs S / Raw 

Ether / IP / TCP 192.111.111.101:ftp_data > 172.17.0.4:bbs S / Raw 

Ether / IP / TCP 192.111.111.101:ftp_data > 172.17.0.4:bbs S / Raw 

Ether / IP / TCP 192.111.111.101:ftp_data > 172.17.0.4:bbs S / Raw 

Ether / IP / TCP 192.111.111.101:ftp_data > 172.17.0.4:bbs S / Raw 

Ether / IP / TCP 192.111.111.101:ftp_data > 172.17.0.4:bbs S / Raw 

Ether / IP / TCP 192.111.111.101:ftp_data > 172.17.0.4:bbs S / Raw 

Ether / IP / TCP 192.111.111.101:ftp_data > 172.17.0.4:bbs S / Raw 

Ether / IP / TCP 192.111.111.101:ftp_data > 172.17.0.4:bbs S / Raw 

Ether / IP / TCP 192.111.111.101:ftp_data > 172.17.0.4:bbs S / Raw 

Ether / IP / TCP 192.111.111.101:ftp_data > 172.17.0.4:bbs S / Raw 

Ether / IP / TCP 192.111.111.101:ftp_data > 172.17.0.4:bbs S / Raw 

Ether / IP / TCP 192.111.111.101:ftp_data > 172.17.0.4:bbs S / Raw 

Ether / IP / TCP 172.17.0.4:bbs > 192.111.111.101:ftp_data SA 

Ether / IP / TCP 192.111.111.101:ftp_data > 172.17.0.4:bbs S / Raw 

Ether / IP / TCP 192.111.111.101:ftp_data > 172.17.0.4:bbs S / Raw 

Ether / IP / TCP 192.111.111.101:ftp_data > 172.17.0.4:bbs S / Raw 

Ether / ARP who has 172.17.0.1 says 172.17.0.6