Ether / ARP who has 172.17.0.1 says 172.17.0.3 

Ether / ARP who has 172.17.0.2 says 172.17.0.4 

Ether / ARP is at 02:42:ac:11:00:02 says 172.17.0.2 

Ether / IP / TCP 192.111.101.101:ftp_data > 172.17.0.2:bbs S / Raw 

Ether / ARP who has 172.17.0.1 says 172.17.0.2 

Ether / ARP is at 02:42:11:4c:a9:53 says 172.17.0.1 

Ether / IP / TCP 172.17.0.2:bbs > 192.111.101.101:ftp_data SA 

Ether / IP / TCP 192.111.101.101:ftp_data > 172.17.0.2:bbs S / Raw 

Ether / IP / TCP 172.17.0.2:bbs > 192.111.101.101:ftp_data SA 

Ether / IP / TCP 192.111.101.101:ftp_data > 172.17.0.2:bbs S / Raw 

Ether / IP / TCP 192.111.101.101:ftp_data > 172.17.0.2:bbs S / Raw 

Ether / IP / TCP 192.111.101.101:ftp_data > 172.17.0.2:bbs S / Raw 

Ether / IP / TCP 192.111.101.101:ftp_data > 172.17.0.2:bbs S / Raw 

Ether / IP / TCP 192.111.101.101:ftp_data > 172.17.0.2:bbs S / Raw 

Ether / IP / TCP 192.111.101.101:ftp_data > 172.17.0.2:bbs S / Raw 

Ether / IP / TCP 192.111.101.101:ftp_data > 172.17.0.2:bbs S / Raw 

Ether / IP / TCP 192.111.101.101:ftp_data > 172.17.0.2:bbs S / Raw 

Ether / IP / TCP 192.111.101.101:ftp_data > 172.17.0.2:bbs S / Raw 

Ether / IP / TCP 192.111.101.101:ftp_data > 172.17.0.2:bbs S / Raw 

Ether / IP / TCP 192.111.101.101:ftp_data > 172.17.0.2:bbs S / Raw 

Ether / IP / TCP 192.111.101.101:ftp_data > 172.17.0.2:bbs S / Raw 

Ether / IP / TCP 192.111.101.101:ftp_data > 172.17.0.2:bbs S / Raw 

Ether / IP / TCP 192.111.101.101:ftp_data > 172.17.0.2:bbs S / Raw 

Ether / IP / TCP 192.111.101.101:ftp_data > 172.17.0.2:bbs S / Raw 

Ether / IP / TCP 192.111.101.101:ftp_data > 172.17.0.2:bbs S / Raw 

Ether / IP / TCP 172.17.0.2:bbs > 192.111.101.101:ftp_data SA 

Ether / IP / TCP 192.111.101.101:ftp_data > 172.17.0.2:bbs S / Raw 

Ether / IP / TCP 192.111.101.101:ftp_data > 172.17.0.2:bbs S / Raw 

Ether / IP / TCP 192.111.101.101:ftp_data > 172.17.0.2:bbs S / Raw 

Ether / IP / TCP 192.111.101.101:ftp_data > 172.17.0.2:bbs S / Raw 

Ether / IP / TCP 192.111.101.101:ftp_data > 172.17.0.2:bbs S / Raw 

Ether / IP / TCP 192.111.101.101:ftp_data > 172.17.0.2:bbs S / Raw 

Ether / IP / TCP 192.111.101.101:ftp_data > 172.17.0.2:bbs S / Raw 

Ether / IP / TCP 192.111.101.101:ftp_data > 172.17.0.2:bbs S / Raw 

Ether / IP / TCP 192.111.101.101:ftp_data > 172.17.0.2:bbs S / Raw 

Ether / IP / TCP 192.111.101.101:ftp_data > 172.17.0.2:bbs S / Raw 

Ether / IP / TCP 192.111.101.101:ftp_data > 172.17.0.2:bbs S / Raw 

Ether / IP / TCP 192.111.101.101:ftp_data > 172.17.0.2:bbs S / Raw 

Ether / IP / TCP 192.111.101.101:ftp_data > 172.17.0.2:bbs S / Raw 

Ether / IP / TCP 192.111.101.101:ftp_data > 172.17.0.2:bbs S / Raw 

Ether / IP / TCP 192.111.101.101:ftp_data > 172.17.0.2:bbs S / Raw 

Ether / IP / TCP 192.111.101.101:ftp_data > 172.17.0.2:bbs S / Raw 

Ether / IP / TCP 192.111.101.101:ftp_data > 172.17.0.2:bbs S / Raw 

Ether / IP / TCP 172.17.0.2:bbs > 192.111.101.101:ftp_data SA 

Ether / IP / TCP 192.111.101.101:ftp_data > 172.17.0.2:bbs S / Raw 

Ether / IP / TCP 192.111.101.101:ftp_data > 172.17.0.2:bbs S / Raw 

Ether / IP / TCP 192.111.101.101:ftp_data > 172.17.0.2:bbs S / Raw 

Ether / IP / TCP 192.111.101.101:ftp_data > 172.17.0.2:bbs S / Raw 

Ether / IP / TCP 192.111.101.101:ftp_data > 172.17.0.2:bbs S / Raw 

Ether / IP / TCP 172.17.0.2:bbs > 192.111.101.101:ftp_data SA 

 