Ether / ARP who has 172.17.0.3 says 172.17.0.4 

Ether / ARP is at 02:42:ac:11:00:03 says 172.17.0.3 

Ether / IP / TCP 192.168.101.101:ftp_data > 172.17.0.3:bbs S / Raw 

Ether / IP / TCP 172.17.0.3:bbs > 192.168.101.101:ftp_data SA 

Ether / IP / TCP 192.168.101.101:ftp_data > 172.17.0.3:bbs S / Raw 

Ether / IP / TCP 172.17.0.3:bbs > 192.168.101.101:ftp_data SA 

Ether / IP / TCP 192.168.101.101:ftp_data > 172.17.0.3:bbs S / Raw 

Ether / IP / TCP 192.168.101.101:ftp_data > 172.17.0.3:bbs S / Raw 

Ether / IP / TCP 192.168.101.101:ftp_data > 172.17.0.3:bbs S / Raw 

Ether / IP / TCP 192.168.101.101:ftp_data > 172.17.0.3:bbs S / Raw 

Ether / IP / TCP 192.168.101.101:ftp_data > 172.17.0.3:bbs S / Raw 

Ether / IP / TCP 192.168.101.101:ftp_data > 172.17.0.3:bbs S / Raw 

Ether / IP / TCP 192.168.101.101:ftp_data > 172.17.0.3:bbs S / Raw 

Ether / IP / TCP 192.168.101.101:ftp_data > 172.17.0.3:bbs S / Raw 

Ether / IP / TCP 192.168.101.101:ftp_data > 172.17.0.3:bbs S / Raw 

Ether / IP / TCP 192.168.101.101:ftp_data > 172.17.0.3:bbs S / Raw 

Ether / IP / TCP 192.168.101.101:ftp_data > 172.17.0.3:bbs S / Raw 

Ether / IP / TCP 192.168.101.101:ftp_data > 172.17.0.3:bbs S / Raw 

Ether / IP / TCP 192.168.101.101:ftp_data > 172.17.0.3:bbs S / Raw 

Ether / IP / TCP 192.168.101.101:ftp_data > 172.17.0.3:bbs S / Raw 

Ether / IP / TCP 192.168.101.101:ftp_data > 172.17.0.3:bbs S / Raw 

Ether / IP / TCP 192.168.101.101:ftp_data > 172.17.0.3:bbs S / Raw 

Ether / IP / TCP 192.168.101.101:ftp_data > 172.17.0.3:bbs S / Raw 

Ether / IP / TCP 192.168.101.101:ftp_data > 172.17.0.3:bbs S / Raw 

Ether / IP / TCP 172.17.0.3:bbs > 192.168.101.101:ftp_data SA 

Ether / IP / TCP 192.168.101.101:ftp_data > 172.17.0.3:bbs S / Raw 

Ether / IP / TCP 192.168.101.101:ftp_data > 172.17.0.3:bbs S / Raw 

Ether / IP / TCP 192.168.101.101:ftp_data > 172.17.0.3:bbs S / Raw 

Ether / IP / TCP 192.168.101.101:ftp_data > 172.17.0.3:bbs S / Raw 

Ether / IP / TCP 192.168.101.101:ftp_data > 172.17.0.3:bbs S / Raw 

Ether / IP / TCP 192.168.101.101:ftp_data > 172.17.0.3:bbs S / Raw 

Ether / IP / TCP 192.168.101.101:ftp_data > 172.17.0.3:bbs S / Raw 

Ether / IP / TCP 192.168.101.101:ftp_data > 172.17.0.3:bbs S / Raw 

Ether / IP / TCP 192.168.101.101:ftp_data > 172.17.0.3:bbs S / Raw 

Ether / IP / TCP 192.168.101.101:ftp_data > 172.17.0.3:bbs S / Raw 

Ether / IP / TCP 192.168.101.101:ftp_data > 172.17.0.3:bbs S / Raw 

Ether / IP / TCP 192.168.101.101:ftp_data > 172.17.0.3:bbs S / Raw 

Ether / IP / TCP 192.168.101.101:ftp_data > 172.17.0.3:bbs S / Raw 

Ether / IP / TCP 192.168.101.101:ftp_data > 172.17.0.3:bbs S / Raw 

Ether / IP / TCP 192.168.101.101:ftp_data > 172.17.0.3:bbs S / Raw 

 